{
  "protocol": "dev.jazz.live-capture",
  "protocolVersion": 1,
  "archiveFixture": "04-meeting-screen-share",
  "archiveId": "ar-44444444-4444-7444-8444-444444444441",
  "originId": "origin-44444444-4444-7444-8444-444444444441",
  "captureId": "cap-44444444-4444-7444-8444-444444444441",
  "messages": [
    {
      "kind": "open",
      "epoch": 1
    },
    {
      "kind": "observation",
      "epoch": 1,
      "deliverySequence": 0,
      "recordDigest": "51794b273e0cfc26a1d6a228f6c7a346fc1b84e607a3b6e3ad3815b724f19f64",
      "record": {
        "schemaVersion": 1,
        "observationId": "obs-44444444-4444-7444-8444-444444444441",
        "originId": "origin-44444444-4444-7444-8444-444444444441",
        "recordType": "jazz.media-observation",
        "payloadSchema": "https://jasnost.dev/schema/media-observation.schema.json",
        "captureId": "cap-44444444-4444-7444-8444-444444444441",
        "streamId": "stream-44444444-4444-7444-8444-444444444441",
        "streamSequence": 0,
        "capturedAt": "2026-07-22T12:00:03.120Z",
        "occurredAt": "2026-07-22T12:00:00.000Z",
        "monotonicTime": {
          "ticks": "0",
          "unit": "nanosecond",
          "clockId": "meeting-video-pts",
          "clockDomainId": "meeting-video-domain",
          "bootId": "meeting-epoch-a"
        },
        "contextRefs": {
          "meeting": {
            "namespace": "meeting.external-id",
            "value": "meeting-opaque-42"
          }
        },
        "sourceRefs": [
          {
            "sourceId": "src-44444444-4444-7444-8444-444444444441",
            "role": "media-clock"
          }
        ],
        "actorRefs": [
          {
            "actorId": "actor-44444444-4444-7444-8444-444444444442",
            "role": "performer",
            "basis": "observed",
            "method": "track_presence"
          }
        ],
        "labelRefs": [],
        "artifactRefs": [
          {
            "artifactId": "art-44444444-4444-7444-8444-444444444441",
            "role": "screen_share_video"
          }
        ],
        "payload": {
          "schemaVersion": 1,
          "segmentId": "video-segment-0",
          "trackId": "screen-track-1",
          "mediaKind": "screen_share_video",
          "artifactId": "art-44444444-4444-7444-8444-444444444441",
          "artifactRole": "screen_share_video",
          "sourceTime": {
            "startTicks": "0",
            "endTicks": "3000000000",
            "unit": "nanosecond",
            "clockId": "meeting-video-pts",
            "clockDomainId": "meeting-video-domain",
            "bootId": "meeting-epoch-a",
            "uncertaintyMillis": 80
          },
          "attribution": {
            "status": "unknown",
            "reason": "screen-share media did not bind the performer to an authenticated participant"
          }
        },
        "provenance": {
          "factClass": "observed",
          "sources": [
            "src-44444444-4444-7444-8444-444444444441"
          ]
        },
        "quality": {
          "status": "complete",
          "reasons": [],
          "timingErrorMillis": 80
        },
        "privacy": {
          "status": "captured",
          "policyVersion": "meeting-consent-v1",
          "redactions": []
        }
      }
    },
    {
      "kind": "observation",
      "epoch": 1,
      "deliverySequence": 1,
      "recordDigest": "49609ee89ea0e6332eb1b694bcfeff01e4bdc3831f890c7b4e70f5c9bf6e25a4",
      "record": {
        "schemaVersion": 1,
        "observationId": "obs-44444444-4444-7444-8444-444444444443",
        "originId": "origin-44444444-4444-7444-8444-444444444441",
        "recordType": "jazz.media-observation",
        "payloadSchema": "https://jasnost.dev/schema/media-observation.schema.json",
        "captureId": "cap-44444444-4444-7444-8444-444444444441",
        "streamId": "stream-44444444-4444-7444-8444-444444444441",
        "streamSequence": 2,
        "capturedAt": "2026-07-22T12:00:09.190Z",
        "occurredAt": "2026-07-22T12:00:06.000Z",
        "monotonicTime": {
          "ticks": "6000000000",
          "unit": "nanosecond",
          "clockId": "meeting-video-pts",
          "clockDomainId": "meeting-video-domain",
          "bootId": "meeting-epoch-a"
        },
        "contextRefs": {
          "meeting": {
            "namespace": "meeting.external-id",
            "value": "meeting-opaque-42"
          }
        },
        "sourceRefs": [
          {
            "sourceId": "src-44444444-4444-7444-8444-444444444441",
            "role": "media-clock"
          }
        ],
        "actorRefs": [
          {
            "actorId": "actor-44444444-4444-7444-8444-444444444442",
            "role": "performer",
            "basis": "observed",
            "method": "track_presence"
          }
        ],
        "labelRefs": [],
        "artifactRefs": [
          {
            "artifactId": "art-44444444-4444-7444-8444-444444444441",
            "role": "screen_share_video"
          }
        ],
        "payload": {
          "schemaVersion": 1,
          "segmentId": "video-segment-2",
          "trackId": "screen-track-1",
          "mediaKind": "screen_share_video",
          "artifactId": "art-44444444-4444-7444-8444-444444444441",
          "artifactRole": "screen_share_video",
          "sourceTime": {
            "startTicks": "6000000000",
            "endTicks": "9000000000",
            "unit": "nanosecond",
            "clockId": "meeting-video-pts",
            "clockDomainId": "meeting-video-domain",
            "bootId": "meeting-epoch-a",
            "uncertaintyMillis": 80
          },
          "attribution": {
            "status": "unknown",
            "reason": "screen-share media did not bind the performer to an authenticated participant"
          }
        },
        "provenance": {
          "factClass": "observed",
          "sources": [
            "src-44444444-4444-7444-8444-444444444441"
          ]
        },
        "quality": {
          "status": "complete",
          "reasons": [],
          "timingErrorMillis": 80
        },
        "privacy": {
          "status": "captured",
          "policyVersion": "meeting-consent-v1",
          "redactions": []
        }
      }
    },
    {
      "kind": "observation",
      "epoch": 1,
      "deliverySequence": 2,
      "recordDigest": "b8682561fc0f06337fc0c2133515023931018c7c5039ebd9319fde909d5b6524",
      "record": {
        "schemaVersion": 1,
        "observationId": "obs-44444444-4444-7444-8444-444444444444",
        "originId": "origin-44444444-4444-7444-8444-444444444441",
        "recordType": "jazz.media-observation",
        "payloadSchema": "https://jasnost.dev/schema/media-observation.schema.json",
        "captureId": "cap-44444444-4444-7444-8444-444444444441",
        "streamId": "stream-44444444-4444-7444-8444-444444444442",
        "streamSequence": 0,
        "capturedAt": "2026-07-22T12:00:09.230Z",
        "occurredAt": "2026-07-22T12:00:00.000Z",
        "monotonicTime": {
          "ticks": "0",
          "unit": "nanosecond",
          "clockId": "meeting-audio-samples",
          "clockDomainId": "meeting-audio-domain",
          "bootId": "meeting-epoch-a"
        },
        "contextRefs": {
          "meeting": {
            "namespace": "meeting.external-id",
            "value": "meeting-opaque-42"
          }
        },
        "sourceRefs": [
          {
            "sourceId": "src-44444444-4444-7444-8444-444444444442",
            "role": "media-clock"
          }
        ],
        "actorRefs": [
          {
            "actorId": "actor-44444444-4444-7444-8444-444444444442",
            "role": "speaker",
            "basis": "observed",
            "method": "track_presence"
          }
        ],
        "labelRefs": [],
        "artifactRefs": [
          {
            "artifactId": "art-44444444-4444-7444-8444-444444444442",
            "role": "meeting_audio"
          }
        ],
        "payload": {
          "schemaVersion": 1,
          "segmentId": "audio-segment-0",
          "trackId": "audio-track-1",
          "mediaKind": "meeting_audio",
          "artifactId": "art-44444444-4444-7444-8444-444444444442",
          "artifactRole": "meeting_audio",
          "sourceTime": {
            "startTicks": "0",
            "endTicks": "9000000000",
            "unit": "nanosecond",
            "clockId": "meeting-audio-samples",
            "clockDomainId": "meeting-audio-domain",
            "bootId": "meeting-epoch-a",
            "uncertaintyMillis": 40
          },
          "attribution": {
            "status": "unknown",
            "reason": "audio track carried no verified speaker identity"
          }
        },
        "provenance": {
          "factClass": "observed",
          "sources": [
            "src-44444444-4444-7444-8444-444444444442"
          ]
        },
        "quality": {
          "status": "complete",
          "reasons": [],
          "timingErrorMillis": 40
        },
        "privacy": {
          "status": "captured",
          "policyVersion": "meeting-consent-v1",
          "redactions": []
        }
      }
    },
    {
      "kind": "observation",
      "epoch": 1,
      "deliverySequence": 3,
      "recordDigest": "29918017471aee139911cec3bbbafa42755e4bd91ef05a0e90ac310a2000d7da",
      "record": {
        "schemaVersion": 1,
        "observationId": "obs-44444444-4444-7444-8444-444444444446",
        "originId": "origin-44444444-4444-7444-8444-444444444441",
        "recordType": "jazz.meeting-control-observation",
        "payloadSchema": "https://jasnost.dev/schema/meeting-control-observation.schema.json",
        "captureId": "cap-44444444-4444-7444-8444-444444444441",
        "streamId": "stream-44444444-4444-7444-8444-444444444444",
        "streamSequence": 0,
        "capturedAt": "2026-07-22T12:00:00.050Z",
        "occurredAt": "2026-07-22T12:00:00.000Z",
        "monotonicTime": {